{
  "version": 1,
  "screen": { "w": 466, "h": 466, "bg": "#000000" },

  "resources": {
    "images": [
      { "name": "background",        "file": "reIMG__RUN_8888" }
    ],
    "anims": [
      { "name": "health", "duration": 800, "repeat": 0, "file": "reIMG__GRP_ANI" }
    ]
  },

  "widgets": [
    {
      "id": "bg",
      "type": "image",
      "image": "background",
      "align": "top_left"
    },
    {
      "id": "loader",
      "type": "frame_anim",
      "anim": "health",
      "align": "left_mid",
      "y": 60
    }
  ]
}
